{
  "$schema": "https://json-schema.org/draft/2020-12/schema",
  "$id": "https://ardur.ai/specs/drp-conformance-bundle-v0.1.schema.json",
  "title": "Ardur DRP Implementation Fixture Bundle v0.1",
  "description": "Portable signed inputs and expected outcomes for Ardur DRP Profile v0.1 implementation self-tests. This schema does not assert IETF or independent conformance.",
  "type": "object",
  "additionalProperties": false,
  "required": [
    "schema_version",
    "bundle_id",
    "draft",
    "profile",
    "claim_boundary",
    "not_claimed",
    "verifier",
    "external_implementations",
    "scenarios"
  ],
  "properties": {
    "schema_version": {
      "const": "ardur.drp_implementation_fixture_bundle.v0.1"
    },
    "bundle_id": {
      "type": "string",
      "pattern": "^[a-z0-9][a-z0-9._-]{0,127}$"
    },
    "draft": {
      "type": "object",
      "additionalProperties": false,
      "required": ["name", "revision", "source", "status"],
      "properties": {
        "name": {
          "const": "draft-nelson-agent-delegation-receipts"
        },
        "revision": {
          "const": "10"
        },
        "source": {
          "const": "https://datatracker.ietf.org/doc/draft-nelson-agent-delegation-receipts/10/"
        },
        "status": {
          "const": "active-individual-internet-draft"
        }
      }
    },
    "profile": {
      "const": "ardur.drp.v0.1"
    },
    "claim_boundary": {
      "const": "Ardur implementation self-test; not IETF or independent conformance evidence"
    },
    "not_claimed": {
      "type": "array",
      "minItems": 4,
      "maxItems": 4,
      "uniqueItems": true,
      "items": {
        "enum": [
          "generic DRP compatibility",
          "IETF conformance",
          "independent implementation interoperability",
          "raw RFC 3161 proof verification"
        ]
      }
    },
    "verifier": {
      "type": "object",
      "additionalProperties": false,
      "required": ["implementation", "profile", "evidence_class"],
      "properties": {
        "implementation": {
          "const": "ardur"
        },
        "profile": {
          "const": "ardur.drp.v0.1"
        },
        "evidence_class": {
          "const": "implementation-self-test"
        }
      }
    },
    "external_implementations": {
      "type": "array",
      "minItems": 2,
      "maxItems": 32,
      "items": {
        "$ref": "#/$defs/externalImplementation"
      }
    },
    "scenarios": {
      "type": "array",
      "minItems": 1,
      "maxItems": 64,
      "items": {
        "$ref": "#/$defs/scenario"
      }
    }
  },
  "$defs": {
    "externalImplementation": {
      "type": "object",
      "additionalProperties": false,
      "required": [
        "name",
        "source",
        "revision",
        "relationship",
        "status",
        "evidence"
      ],
      "properties": {
        "name": {
          "type": "string",
          "minLength": 1,
          "maxLength": 128
        },
        "source": {
          "type": ["string", "null"],
          "format": "uri",
          "maxLength": 2048
        },
        "revision": {
          "type": ["string", "null"],
          "maxLength": 128
        },
        "relationship": {
          "enum": ["draft-author", "independent"]
        },
        "status": {
          "enum": ["incompatible-wire", "not-demonstrated"]
        },
        "evidence": {
          "type": "string",
          "minLength": 1,
          "maxLength": 2048
        }
      }
    },
    "scenario": {
      "type": "object",
      "additionalProperties": false,
      "required": [
        "scenario_id",
        "description",
        "risk_class",
        "receipts",
        "context",
        "action",
        "decision_time",
        "offline",
        "expected"
      ],
      "properties": {
        "scenario_id": {
          "type": "string",
          "pattern": "^DRP-[A-Z0-9-]{2,64}$"
        },
        "description": {
          "type": "string",
          "minLength": 1,
          "maxLength": 512
        },
        "risk_class": {
          "enum": [
            "authorization_validity",
            "authority_widening",
            "temporal_validity",
            "revocation",
            "redelegation",
            "wire_compatibility"
          ]
        },
        "receipts": {
          "type": "array",
          "minItems": 1,
          "maxItems": 32,
          "items": {
            "type": "object"
          }
        },
        "context": {
          "$ref": "#/$defs/context"
        },
        "action": {
          "$ref": "#/$defs/action"
        },
        "decision_time": {
          "type": "string",
          "format": "date-time",
          "pattern": "Z$",
          "maxLength": 32
        },
        "offline": {
          "type": "boolean"
        },
        "expected": {
          "$ref": "#/$defs/expected"
        }
      }
    },
    "context": {
      "type": "object",
      "additionalProperties": false,
      "required": [
        "signer_keys",
        "operator_instructions",
        "tool_universes",
        "log_evidence",
        "revocation_evidence",
        "receipt_chain_evidence"
      ],
      "properties": {
        "signer_keys": {
          "type": "object",
          "maxProperties": 32,
          "propertyNames": {
            "type": "string",
            "minLength": 1,
            "maxLength": 2048
          },
          "additionalProperties": {
            "type": "string",
            "pattern": "^-----BEGIN PUBLIC KEY-----\\n[A-Za-z0-9+/=\\n]+-----END PUBLIC KEY-----\\n$",
            "maxLength": 512
          }
        },
        "operator_instructions": {
          "type": "object",
          "maxProperties": 32,
          "propertyNames": {
            "$ref": "#/$defs/receiptId"
          },
          "additionalProperties": {
            "type": "string",
            "maxLength": 262144
          }
        },
        "tool_universes": {
          "type": "object",
          "maxProperties": 16,
          "propertyNames": {
            "type": "string",
            "pattern": "^sha256:[0-9a-f]{64}$"
          },
          "additionalProperties": {
            "type": "array",
            "minItems": 1,
            "maxItems": 4096,
            "items": {
              "$ref": "#/$defs/actionDescriptor"
            }
          }
        },
        "log_evidence": {
          "type": "array",
          "maxItems": 32,
          "items": {
            "$ref": "#/$defs/logEvidence"
          }
        },
        "revocation_evidence": {
          "type": "array",
          "maxItems": 32,
          "items": {
            "$ref": "#/$defs/revocationEvidence"
          }
        },
        "receipt_chain_evidence": {
          "type": "array",
          "maxItems": 32,
          "items": {
            "$ref": "#/$defs/receiptChainEvidence"
          }
        }
      }
    },
    "actionDescriptor": {
      "type": "object",
      "additionalProperties": false,
      "required": ["operation", "resource"],
      "properties": {
        "operation": {
          "type": "string",
          "minLength": 1,
          "maxLength": 256
        },
        "resource": {
          "type": "string",
          "minLength": 1,
          "maxLength": 2048
        }
      }
    },
    "action": {
      "type": "object",
      "additionalProperties": false,
      "required": [
        "operation",
        "resource",
        "arguments",
        "sideEffectClass",
        "cwd"
      ],
      "properties": {
        "operation": {
          "type": "string",
          "minLength": 1,
          "maxLength": 256
        },
        "resource": {
          "type": "string",
          "minLength": 1,
          "maxLength": 2048
        },
        "arguments": {
          "type": "object",
          "maxProperties": 1024
        },
        "sideEffectClass": {
          "type": "string",
          "minLength": 1,
          "maxLength": 256
        },
        "cwd": {
          "type": "string",
          "pattern": "^/",
          "maxLength": 4096
        }
      }
    },
    "logEvidence": {
      "type": "object",
      "additionalProperties": false,
      "required": [
        "receipt_id",
        "backend",
        "subject",
        "integrated_at",
        "proof_ref",
        "included_before_use"
      ],
      "properties": {
        "receipt_id": {
          "$ref": "#/$defs/receiptId"
        },
        "backend": {
          "type": "string",
          "minLength": 1,
          "maxLength": 128
        },
        "subject": {
          "const": "receipt-id"
        },
        "integrated_at": {
          "type": "string",
          "format": "date-time",
          "pattern": "Z$",
          "maxLength": 32
        },
        "proof_ref": {
          "type": "string",
          "format": "uri",
          "maxLength": 2048
        },
        "included_before_use": {
          "type": "boolean"
        }
      }
    },
    "revocationEvidence": {
      "type": "object",
      "additionalProperties": false,
      "required": ["ref", "status", "observed_at", "valid_until", "source"],
      "properties": {
        "ref": {
          "type": "string",
          "format": "uri",
          "maxLength": 2048
        },
        "status": {
          "enum": ["active", "revoked", "unknown"]
        },
        "observed_at": {
          "type": "string",
          "format": "date-time",
          "pattern": "Z$",
          "maxLength": 32
        },
        "valid_until": {
          "type": "string",
          "format": "date-time",
          "pattern": "Z$",
          "maxLength": 32
        },
        "source": {
          "type": "string",
          "format": "uri",
          "maxLength": 2048
        }
      }
    },
    "receiptChainEvidence": {
      "type": "object",
      "additionalProperties": false,
      "required": [
        "receipt_id",
        "trace_id",
        "head_receipt_id",
        "head_receipt_jwt_sha256",
        "observed_at",
        "source"
      ],
      "properties": {
        "receipt_id": {
          "$ref": "#/$defs/receiptId"
        },
        "trace_id": {
          "type": "string",
          "minLength": 1,
          "maxLength": 512
        },
        "head_receipt_id": {
          "type": "string",
          "minLength": 1,
          "maxLength": 512
        },
        "head_receipt_jwt_sha256": {
          "type": "string",
          "pattern": "^[0-9a-f]{64}$"
        },
        "observed_at": {
          "type": "string",
          "format": "date-time",
          "pattern": "Z$",
          "maxLength": 32
        },
        "source": {
          "type": "string",
          "format": "uri",
          "maxLength": 2048
        }
      }
    },
    "expected": {
      "type": "object",
      "additionalProperties": false,
      "required": ["decision", "reason_code", "receipt_id"],
      "properties": {
        "decision": {
          "enum": ["PERMIT", "DENY"]
        },
        "reason_code": {
          "type": "string",
          "pattern": "^(verified|[A-Z][A-Z0-9_]{1,63})$"
        },
        "receipt_id": {
          "oneOf": [
            {
              "$ref": "#/$defs/receiptId"
            },
            {
              "type": "null"
            }
          ]
        }
      }
    },
    "receiptId": {
      "type": "string",
      "pattern": "^rec_[0-9a-f]{64}$"
    }
  }
}
