{"bundle_id":"ardur-drp-v0.1-draft-10-implementation-fixtures","claim_boundary":"Ardur implementation self-test; not IETF or independent conformance evidence","draft":{"name":"draft-nelson-agent-delegation-receipts","revision":"10","source":"https://datatracker.ietf.org/doc/draft-nelson-agent-delegation-receipts/10/","status":"active-individual-internet-draft"},"external_implementations":[{"evidence":"Legacy fields, signatures, identifiers, and time-window shape do not satisfy the draft-10-pinned Ardur profile schema.","name":"authproof-sdk","relationship":"draft-author","revision":"ae1c56da7f55965c229d1b0a638d5390b4882123","source":"https://github.com/Commonguy25/authproof-sdk","status":"incompatible-wire"},{"evidence":"No independently maintained compatible verifier was identified or passed against this bundle.","name":"independent-verifier","relationship":"independent","revision":null,"source":null,"status":"not-demonstrated"}],"not_claimed":["generic DRP compatibility","IETF conformance","independent implementation interoperability","raw RFC 3161 proof verification"],"profile":"ardur.drp.v0.1","scenarios":[{"action":{"arguments":{"calendar_id":"team"},"cwd":"/workspace/project","operation":"read","resource":"tool://calendar/team","sideEffectClass":"none"},"context":{"log_evidence":[{"backend":"rfc3161-log","included_before_use":true,"integrated_at":"2027-01-15T07:58:00Z","proof_ref":"https://fixture.ardur.dev/log/rec_c64424a24df4f720c3ff55731adf5d80af8581a2f6875234b0b748f84342a706","receipt_id":"rec_c64424a24df4f720c3ff55731adf5d80af8581a2f6875234b0b748f84342a706","subject":"receipt-id"},{"backend":"rfc3161-log","included_before_use":true,"integrated_at":"2027-01-15T07:58:30Z","proof_ref":"https://fixture.ardur.dev/log/rec_40977554f196e788e86eb73883797fd36a3aa240bebd0e40789ec4a31f84bcfa","receipt_id":"rec_40977554f196e788e86eb73883797fd36a3aa240bebd0e40789ec4a31f84bcfa","subject":"receipt-id"},{"backend":"rfc3161-log","included_before_use":true,"integrated_at":"2027-01-15T07:59:00Z","proof_ref":"https://fixture.ardur.dev/log/rec_40558892f22e1d9833807406ff61ee96a8f1918f3965d333a14879161ccfd206","receipt_id":"rec_40558892f22e1d9833807406ff61ee96a8f1918f3965d333a14879161ccfd206","subject":"receipt-id"}],"operator_instructions":{"rec_40558892f22e1d9833807406ff61ee96a8f1918f3965d333a14879161ccfd206":"Read the approved calendar data for the team.","rec_40977554f196e788e86eb73883797fd36a3aa240bebd0e40789ec4a31f84bcfa":"Read the approved calendar data for the team.","rec_c64424a24df4f720c3ff55731adf5d80af8581a2f6875234b0b748f84342a706":"Read the approved calendar data for the team."},"receipt_chain_evidence":[],"revocation_evidence":[{"observed_at":"2027-01-15T07:59:55Z","ref":"https://fixture.ardur.dev/revocations/0#idx=0","source":"https://fixture.ardur.dev/revocations","status":"active","valid_until":"2027-01-15T08:05:00Z"},{"observed_at":"2027-01-15T07:59:55Z","ref":"https://fixture.ardur.dev/revocations/1#idx=1","source":"https://fixture.ardur.dev/revocations","status":"active","valid_until":"2027-01-15T08:05:00Z"},{"observed_at":"2027-01-15T07:59:55Z","ref":"https://fixture.ardur.dev/revocations/2#idx=2","source":"https://fixture.ardur.dev/revocations","status":"active","valid_until":"2027-01-15T08:05:00Z"}],"signer_keys":{"spiffe://fixture.ardur.dev/agent/calendar-reader":"-----BEGIN PUBLIC KEY-----\nMFkwEwYHKoZIzj0CAQYIKoZIzj0DAQcDQgAE1ZTc3/ukdimiYb2AtTvoykDXP7st\nYroombBjppIcjq8lnnFCNVwH/4LxcpTJULukzEXglzdxOZFL40ng5iaMeA==\n-----END PUBLIC KEY-----\n","spiffe://fixture.ardur.dev/orchestrator/calendar":"-----BEGIN PUBLIC KEY-----\nMFkwEwYHKoZIzj0CAQYIKoZIzj0DAQcDQgAEu6J97HFQEEOAQq7/y53/0CKnq7mb\n9UBfAbztFzmgzvvaVVRXXIykERMSIM1f3p0Tvajm07WbMdUCfBsSMPH/7Q==\n-----END PUBLIC KEY-----\n","spiffe://fixture.ardur.dev/user/alice":"-----BEGIN PUBLIC KEY-----\nMFkwEwYHKoZIzj0CAQYIKoZIzj0DAQcDQgAECtBNb13dK+EGSjp11RBZhw6vWpYy\nG7JILcfy81AP5exdt1BjM7xEElmrIpG6xDpdpwZmrCRHK+z6APsXApLVhw==\n-----END PUBLIC KEY-----\n"},"tool_universes":{"sha256:d4a13ef3dc5adcfecd6a32c1b749c7412953225a73711ac09b79d0b6c46eaf49":[{"operation":"read","resource":"tool://calendar/team"},{"operation":"read","resource":"tool://calendar/personal"},{"operation":"write","resource":"tool://calendar/team"},{"operation":"delete","resource":"tool://calendar/team"}]}},"decision_time":"2027-01-15T08:00:00Z","description":"A valid root-child-grandchild profile chain permits the bounded action.","expected":{"decision":"PERMIT","reason_code":"verified","receipt_id":"rec_40558892f22e1d9833807406ff61ee96a8f1918f3965d333a14879161ccfd206"},"offline":false,"receipts":[{"boundaries":["deny:delete:*","x-ardur:cwd:/workspace/project"],"canonicalPayload":"eyJib3VuZGFyaWVzIjpbImRlbnk6ZGVsZXRlOioiLCJ4LWFyZHVyOmN3ZDovd29ya3NwYWNlL3Byb2plY3QiXSwibWV0YWRhdGEiOnsieC1hcmR1ciI6eyJhcmd1bWVudENvbnN0cmFpbnRzIjp7InRvb2w6Ly9jYWxlbmRhci90ZWFtIjp7ImNhbGVuZGFyX2lkIjp7ImNvbnN0cmFpbnRUeXBlIjoib25lX29mIiwidmFsdWVzIjpbInRlYW0iLCJwZXJzb25hbCJdfX19LCJhdWRpZW5jZSI6ImFyZHVyLXZlcmlmaWVyIiwiYnVkZ2V0Ijp7Im1heFRvb2xDYWxscyI6OCwibWF4VG9vbENhbGxzUGVyQ2xhc3MiOnsibm9uZSI6OCwic3RhdGVfY2hhbmdlIjo0fSwicmVzZXJ2ZWRTaGFyZSI6NH0sImNhcGFiaWxpdHlUb2tlblJlZiI6eyJob2xkZXJDb25maXJtYXRpb24iOnsiandrVGh1bWJwcmludCI6IkFBQUFBQUFBQUFBQUFBQUFBQUFBQUFBQUFBQUFBQUFBQUFBQUFBQUFBQUEifSwibWVkaWFUeXBlIjoiYXBwbGljYXRpb24vYWF0K2p3dCIsInNoYTI1NiI6ImNiY2VjOTJhNDlhMTFlMjFiYTk3Nzk1NGEwOGNhYWZhNjc1MmFkMzQ3YzcwNzA5ZjI1OGJjYzc3OTk3NTEwOGMiLCJ0b2tlblR5cGUiOiJkZWxlZ2F0aW9uIiwidG9vbE1hbmlmZXN0RGlnZXN0Ijoic2hhMjU2OmQ0YTEzZWYzZGM1YWRjZmVjZDZhMzJjMWI3NDljNzQxMjk1MzIyNWE3MzcxMWFjMDliNzlkMGI2YzQ2ZWFmNDkifSwiY3JpdGljYWwiOlsiL21ldGFkYXRhL3gtYXJkdXIvYXJndW1lbnRDb25zdHJhaW50cyIsIi9tZXRhZGF0YS94LWFyZHVyL2J1ZGdldCIsIi9tZXRhZGF0YS94LWFyZHVyL2NhcGFiaWxpdHlUb2tlblJlZiIsIi9tZXRhZGF0YS94LWFyZHVyL2RlbGVnYXRpb25Mb2dBbmNob3IiLCIvbWV0YWRhdGEveC1hcmR1ci9taXNzaW9uUmVmIiwiL21ldGFkYXRhL3gtYXJkdXIvcG9saWN5IiwiL21ldGFkYXRhL3gtYXJkdXIvcmVjZWlwdENoYWluQW5jaG9yIiwiL21ldGFkYXRhL3gtYXJkdXIvcmVkZWxlZ2F0aW9uIiwiL21ldGFkYXRhL3gtYXJkdXIvcmVzb3VyY2VCb3VuZHMiLCIvbWV0YWRhdGEveC1hcmR1ci9yZXZvY2F0aW9uIl0sImRlbGVnYXRpb25HcmFudElkIjoidXJuOnV1aWQ6cHVibGljLWZpeHR1cmUtZ3JhbnQtMCIsImRlbGVnYXRpb25Mb2dBbmNob3IiOnsiYmFja2VuZCI6InJmYzMxNjEtbG9nIiwicmVxdWlyZWQiOnRydWUsInN1YmplY3QiOiJyZWNlaXB0LWlkIn0sImlzc3VlciI6InNwaWZmZTovL2ZpeHR1cmUuYXJkdXIuZGV2L3VzZXIvYWxpY2UiLCJtaXNzaW9uUmVmIjp7Im1pc3Npb25EaWdlc3QiOiJzaGEtMjU2OmI3MmY4MDA2N2UyOTAxM2I5ZjhlMjFlZTk4MGM3NzdhZDJiMjk0MzNhYTYyZDA1YjhkOGY0MmFkMDVlMzQwNzYiLCJ1cmkiOiJodHRwczovL2ZpeHR1cmUuYXJkdXIuZGV2L21pc3Npb25zL2NhbGVuZGFyIn0sInBvbGljeSI6eyJkaWdlc3QiOiJzaGEtMjU2OmE1NTkzYTMyNGI3Mzg2MzhlODk4YTA0Y2MyZWRiMzE0OTczYjBiNTMxMjc0MmNiMzcxZGI3ZGY0M2Q4ZTY5MWMiLCJ2ZXJzaW9uIjoiZml4dHVyZS1wb2xpY3ktdjEifSwicHJvZmlsZSI6ImFyZHVyLmRycC52MC4xIiwicmVjZWlwdENoYWluQW5jaG9yIjp7ImhlYWRSZWNlaXB0SWQiOm51bGwsImhlYWRSZWNlaXB0Snd0U2hhMjU2IjpudWxsLCJzdGF0ZSI6InVuc3RhcnRlZCIsInRyYWNlSWQiOm51bGx9LCJyZWRlbGVnYXRpb24iOnsiZGVwdGgiOjAsIm1heERlcHRoIjo0LCJtb2RlIjoiYm91bmRlZCJ9LCJyZXNvdXJjZUJvdW5kcyI6eyJjd2QiOiIvd29ya3NwYWNlIiwicmVzb3VyY2VzIjpbInRvb2w6Ly9jYWxlbmRhci8qIl0sInNpZGVFZmZlY3RDbGFzc2VzIjpbIm5vbmUiLCJzdGF0ZV9jaGFuZ2UiXX0sInJldm9jYXRpb24iOnsiY2FzY2FkZSI6Imlzc3Vlci1wb2xpY3kiLCJyZWYiOiJodHRwczovL2ZpeHR1cmUuYXJkdXIuZGV2L3Jldm9jYXRpb25zLzAjaWR4PTAiLCJyZXF1aXJlZCI6dHJ1ZX0sInN1YmplY3QiOiJzcGlmZmU6Ly9maXh0dXJlLmFyZHVyLmRldi9vcmNoZXN0cmF0b3IvY2FsZW5kYXIifX0sIm9wZXJhdG9ySW5zdHJ1Y3Rpb25zIjoiUmVhZCB0aGUgYXBwcm92ZWQgY2FsZW5kYXIgZGF0YSBmb3IgdGhlIHRlYW0uIiwib3BlcmF0b3JJbnN0cnVjdGlvbnNIYXNoIjoic2hhMjU2OmQ5YWY5NTM2MTU3MGNmZWJmNmMwZDkzODc4NTg0NzcwMGUwOGNkNmU3NGI1Y2ZkYjY4ZDBjZTJhOGE1NmU4M2EiLCJwdWJsaWNLZXkiOnsiY3J2IjoiUC0yNTYiLCJrdHkiOiJFQyIsIngiOiJDdEJOYjEzZEstRUdTanAxMVJCWmh3NnZXcFl5RzdKSUxjZnk4MUFQNWV3IiwieSI6IlhiZFFZek84UkJKWnF5S1J1c1E2WGFjR1pxd2tSeXZzLWdEN0Z3S1MxWWMifSwicmVjZWlwdElkIjoicmVjX2M2NDQyNGEyNGRmNGY3MjBjM2ZmNTU3MzFhZGY1ZDgwYWY4NTgxYTJmNjg3NTIzNGIwYjc0OGY4NDM0MmE3MDYiLCJyZXZvY2F0aW9uUmVxdWlyZWQiOnRydWUsInNjaGVtYVZlcnNpb24iOiIxLjAiLCJzY29wZSI6eyJhbGxvd2VkQWN0aW9ucyI6W3sib3BlcmF0aW9uIjoicmVhZCIsInJlc291cmNlIjoidG9vbDovL2NhbGVuZGFyL3RlYW0ifSx7Im9wZXJhdGlvbiI6InJlYWQiLCJyZXNvdXJjZSI6InRvb2w6Ly9jYWxlbmRhci9wZXJzb25hbCJ9LHsib3BlcmF0aW9uIjoid3JpdGUiLCJyZXNvdXJjZSI6InRvb2w6Ly9jYWxlbmRhci90ZWFtIn1dLCJkZW5pZWRBY3Rpb25zIjpbeyJvcGVyYXRpb24iOiJkZWxldGUiLCJyZXNvdXJjZSI6IioifV19LCJ0aW1lV2luZG93Ijp7Im5vdEFmdGVyIjoiMjAyNy0wMS0xNVQwODoxMDowMFoiLCJub3RCZWZvcmUiOiIyMDI3LTAxLTE1VDA3OjU1OjAwWiJ9LCJ0b29sU2NoZW1hSGFzaCI6InNoYTI1NjpkNGExM2VmM2RjNWFkY2ZlY2Q2YTMyYzFiNzQ5Yzc0MTI5NTMyMjVhNzM3MTFhYzA5Yjc5ZDBiNmM0NmVhZjQ5In0","metadata":{"x-ardur":{"argumentConstraints":{"tool://calendar/team":{"calendar_id":{"constraintType":"one_of","values":["team","personal"]}}},"audience":"ardur-verifier","budget":{"maxToolCalls":8,"maxToolCallsPerClass":{"none":8,"state_change":4},"reservedShare":4},"capabilityTokenRef":{"holderConfirmation":{"jwkThumbprint":"AAAAAAAAAAAAAAAAAAAAAAAAAAAAAAAAAAAAAAAAAAA"},"mediaType":"application/aat+jwt","sha256":"cbcec92a49a11e21ba977954a08caafa6752ad347c70709f258bcc779975108c","tokenType":"delegation","toolManifestDigest":"sha256:d4a13ef3dc5adcfecd6a32c1b749c7412953225a73711ac09b79d0b6c46eaf49"},"critical":["/metadata/x-ardur/argumentConstraints","/metadata/x-ardur/budget","/metadata/x-ardur/capabilityTokenRef","/metadata/x-ardur/delegationLogAnchor","/metadata/x-ardur/missionRef","/metadata/x-ardur/policy","/metadata/x-ardur/receiptChainAnchor","/metadata/x-ardur/redelegation","/metadata/x-ardur/resourceBounds","/metadata/x-ardur/revocation"],"delegationGrantId":"urn:uuid:public-fixture-grant-0","delegationLogAnchor":{"backend":"rfc3161-log","required":true,"subject":"receipt-id"},"issuer":"spiffe://fixture.ardur.dev/user/alice","missionRef":{"missionDigest":"sha-256:b72f80067e29013b9f8e21ee980c777ad2b29433aa62d05b8d8f42ad05e34076","uri":"https://fixture.ardur.dev/missions/calendar"},"policy":{"digest":"sha-256:a5593a324b738638e898a04cc2edb314973b0b5312742cb371db7df43d8e691c","version":"fixture-policy-v1"},"profile":"ardur.drp.v0.1","receiptChainAnchor":{"headReceiptId":null,"he